cleaned_text,date,sentiment_score,polarity,subjectivity,likes_count,retweets_count,replies_count
_nafnlaus _Enforcement  and  should sue  (AKA Randeep Hothi) and the _Enforcement should investigate whether  has  short position and tried  manipulate the stock with this criminal attack. This pathetic man should   prison.,2019-04-20,-0.9999583959579468,-0.4666666666666666,0.6166666666666667,6,2,0
New post (With Interest: The Week  Business: Pinterest Provides ... Inspiration and Tesla Shows Off Self-Driving Cars) has been published  easy stock market -  ,2019-04-20,0.5003780722618103,0.28484848484848485,0.6439393939393939,0,0,0
" _nafnlaus _Jon    _Enforcement Shorts are not investors, they hold  stock.  Shorts artificially increase the supply  stock, driving the price down  harm companies.  Shorting  itself  stock manipulation and incentives any behavior that would harm stock value.",2019-04-20,-0.9992830157279968,-0.37777777777777777,0.6444444444444445,0,0,0
"_truth   haven' seen one compelling argument   long the stock. Where are these futures earnings coming from? Autonomous fleet.  best that' + years away. And  that time, don' you think Uber  Waymo, with infinitely deeper pockets, will  there first?",2019-04-20,-0.8194394111633301,0.38,0.4666666666666667,1,0,2
"Bravo   This   perfect example  why “shorting” (betting  stock price will  down) only leads  bad behavior,  this case illegal behavior! Great job exposing this criminal activity _nafnlaus",2019-04-20,0.9654738306999207,-0.011507936507936483,0.6793650793650794,1,0,0
$tslaq not ALL dumb? Some paid  TESLA. More than $ trillion  lose&;&;&;  -attack Musk -suppress the stock price  -slow  growth  Even _Enforcement has anti-Tesla industry links.  Best pro $TSLA fight: buy shares!? (ability  hold for years  ESSENTIAL?),2019-04-20,-0.9991874098777771,0.16499999999999998,0.4,7,3,0
  Agree but don’ think they have ever gone out  stock for those?,2019-04-20,-0.9690490365028381,0.0,0.0,1,0,1
_61  Odd but hope they can  least keep plenty  stock.,2019-04-20,-0.9918698072433472,-0.23333333333333334,0.325,2,0,1
Tesla’ Elon Musk could earn   $. billion from stock options - Fox Business  ,2019-04-20,-0.5572261810302734,0.0,0.0,0,0,0
TESLA’ TESLA could earn   $. billion from stock options Full Story:    ,2019-04-20,-0.7334710955619812,0.35,0.55,1,0,0
Tesla’ Elon Musk could earn   $. billion from stock options - Fox Business   via ,2019-04-20,-0.5336315631866455,0.0,0.0,0,0,0
Tesla' Elon Musk could earn   $. billion from stock options - Fox Business |  wonder  ’ thank .. taxpayers for making him richer?  ,2019-04-20,-0.9371852278709412,0.0,0.0,0,0,0
Tesla Stock Drops After Elon Musk’ Emotional Interview With The NYT    ,2019-04-20,-0.9998080134391785,0.0,0.65,0,0,0
Tesla’ Elon Musk could earn   $. billion from stock options - Fox Business    Business  ,2019-04-20,0.5680623650550842,0.0,0.0,1,4,0
Tesla’ Elon Musk earned $. billion  2018 from stock options - Fox Business   via ,2019-04-20,0.9753465056419373,0.0,0.0,0,0,0
TESLA’ TESLA could earn   $. billion from stock options   ,2019-04-20,-0.6490071415901184,0.0,0.0,1,0,0
"When  wrote this story last summer, both Lambert and Weintraub told  that they did not own Tesla stock  that time. Apparently that has changed... although their vague and buried ""disclosure"" hasn'.  ",2019-04-20,-0.9891217350959778,-0.1875,0.47916666666666663,21,8,1
Unreasonably mad  cant find  stock image  someone playing  original Gameboy while driving  Tesla. Wtf kind  sick world  this,2019-04-20,-0.9932841062545776,-0.17285714285714288,0.9014285714285715,2,0,0
Tesla’ Elon Musk could earn   $. billion from stock options - Fox Business  ,2019-04-20,-0.5572261810302734,0.0,0.0,0,0,0
"  _truth   carmaker the stock price   now ( overvalue you could say ) , but Tesla  more than  car company , that’ what  think and because  that the stock will    the future",2019-04-20,0.6800251007080078,0.25,0.3125,2,0,0
"      also curious that ride sharing was not innovated  the traditional rental car companies, but these things need  disruptive leader  the helm rather than  corporate “business  usual” mindset with “private equity” owners   stock market  answer .",2019-04-20,0.9103860259056091,-0.06999999999999999,0.475,0,0,0
  _truth The stock right now has  good price but technology and FSD are gonna make      the long run starting Monday,2019-04-20,-0.6080388426780701,0.2339285714285714,0.4089285714285714,2,0,1
Tesla’ Elon Musk could earn   $. billion from stock options – Fox Business  ,2019-04-20,-0.7349779605865479,0.0,0.0,0,0,0
"_61  need alignment  like the idea  going  Tesla especially  getting stock tires.  would swap  the extra wheels myself and have MrTire put  the tires,  they have what you want get  there.   was buying now  would get Conti pure contact  but  Conti  mrtire",2019-04-20,-0.9797205328941345,0.07142857142857142,0.5333333333333333,1,0,1
Stock Scope: Indicators  View for Tesla Inc (TSLA)  Channel Indicator Reaches Hold - Chandler Caller   dlvrit TESLA,2019-04-20,-0.979656457901001,0.0,0.0,0,0,0
Tesla’ Elon Musk could earn   $. billion from stock options -   TESLA TESLA,2019-04-20,0.5847842693328857,0.0,0.0,0,0,0
Tesla’ Elon Musk could earn   $. billion from stock options – Fox Business  ,2019-04-20,-0.7349779605865479,0.0,0.0,0,0,0
Tesla’ Elon Musk could earn   $. billion from stock options – Fox Business  ,2019-04-20,-0.7349779605865479,0.0,0.0,0,0,0
   _truth      tomorrow Tesla announces they are scrapping Tesla Network plans the stock will tank minimum % just  the  news. Then lot  bulls/funds whose bullish thesis involve Tesla network will slowly bail out adding more downward pressure.  would say min %,2019-04-20,-0.9999746084213257,0.09999999999999998,0.44999999999999996,0,0,0
"_bosman  ' been given warnings from  lot  impt people incl  his board  not   Twitter rampages that affect Tesla' stock.  ' respond  customers, announce stuff that' been  through corp comm  legal, and engage  silly fun stuff.",2019-04-20,-0.8976446986198425,0.0,0.425,1,0,0
Tesla’ Elon Musk could earn   $. billion from stock options – Fox Business    ,2019-04-20,-0.7349779605865479,0.0,0.0,0,0,0
Tesla’ Elon Musk could earn   $. billion from stock options    TESLA,2019-04-20,-0.5619398951530457,0.0,0.0,0,0,0
Tesla’ Elon Musk could earn   $. billion from stock options  ,2019-04-20,-0.6237894892692566,0.0,0.0,0,0,0
Tesla Stock Speeds Toward Brink  Analyst Warns  &amp;TESLA;Outright Disaster&amp;TESLA;  ,2019-04-20,-0.9974485039710999,0.0,0.0,0,0,0
Recall that ’ been  long-time $TSLA bear  until  changed  mind  the midst  all this research. ’ now been buying  lot  Tesla stock for  hedge fund and personal account.  feel like  got really lucky  the timing  this Tesla change  heart here. (contd),2019-04-20,0.9281612634658813,0.16666666666666666,0.5666666666666667,7,2,4
 Are you running ” still? Any recommendations for what  replace the stock Tesla tires with?  Apparently Tesla charges $350  just put new tires  wheels...   nvm just going  get  alignment done  Tesla.,2019-04-20,-0.9998576641082764,0.09318181818181817,0.4022727272727272,1,0,2
Tesla’ Elon Musk could earn   $. billion from stock options    TESLA,2019-04-20,-0.5619398951530457,0.0,0.0,1,0,0
Damn few people understand Corporate/Executive stock options. Tesla’ Elon Musk earned $. billion from stock options    TESLA,2019-04-20,0.9913873076438904,-0.2,0.1,0,0,0
"Stock returns over past  years:  Tesla: +,708% AMD: +,563% Etsy: +,523% Nvidia: +,245% PayPal: +580% Adobe: +542% Netflix: +486% Microsoft: +420% Apple: +406% Amazon: +329% Google: +262% Salesforce: +255% Twitter: +240% Zillow: +183% Facebook: +178% eBay: +131% Alibaba: +%",2021-09-25,0.9990360736846924,-0.25,0.25,1,0,0
Your economic reminder that stock isn’ money and the day Elon puts his entire stock  fund random students tuition . Tesla stock will drop like  rock because  the simple law  supply and demand.,2021-09-25,-0.9986312985420227,-0.075,0.4205357142857143,1,0,1
" lithium, coltan, zinc, copper, silver, and  course, water, all become more and more scarce and  enter the long predicted era  water wars and civilizational contraction, Bitcoin- like Tesla stock- serves   measure for the overall value  electricity and electronics.",2021-09-25,0.9454037547111511,0.2375,0.35,0,0,0
        Union' create   . them attitude. Elon already has unions called SpaceX &amp; Tesla which give employees stock options instead  taking away some  their pay for 'who knows what' fees unions extract from EVERY worker whether they like   not.  need  new name for this.🤔,2021-09-25,-0.7192274928092957,0.13636363636363635,0.45454545454545453,0,0,2
"TESLA $TSLA drivers can now request Full Self-Driving Beta with the press   button, despite safety concerns   TESLA  ",2021-09-25,-0.9762517213821411,0.35,0.55,0,0,0
"/  rich people cashed out their money, they wouldn'  rich.  Getting really rich  accumulating wealth through the increase  value  holdings, such   Amazon  Tesla stock  tax free.  Becoming  billionaire  tax free.  Taxes are for money you earn  working.",2021-09-25,-0.9906181693077087,0.3392857142857143,0.7428571428571429,2,0,0
" Truly round   the Tesla Quacks. First time  got  see financial media being embarrassed after deriding retail for buying Tesla stock. Now '  the ""tech"" media' turn for their nonsensical takedowns  autopilot/full self-driving. Can' wait  see the highlight reels",2021-09-25,-0.5297372937202454,0.016666666666666663,0.24444444444444446,0,0,0
"      Good idea stock … ’ heard winter tires could  hard  get certain sizes, probably from material shortages somewhere along the way",2021-09-25,-0.9579814672470093,0.2075396825396825,0.571031746031746,1,0,0
"""Beware the piss gravure,"" intones the oracle, who  obviously just some chick who  high.  Later, picking  way tediously down the mountain,  miss the snowfield with ""divest from all Tesla stock immediately"" writ large  yellow.",2021-09-25,-0.9999202489852905,0.03645502645502645,0.29291005291005295,3,0,0
  could  worse. They think Elon'  fraud and Tesla  going bankrupt  why would you ever buy the stock. Speaking from experience.,2021-09-25,-0.9999712705612183,-0.4,0.6,1,0,0
"   Action speaks louder than words  .   let’ try and reward these hard workers with bonuses  how about some stock  the company. Don’ know   already does practice such  thing, but just  case they don’, here’  reminder.",2021-09-25,-0.9502841830253601,-0.0638888888888889,0.38055555555555554,1,0,1
     Can' treat Musk  $TSLA with little kid gloves. The only thing that psychopath understands  money.  thinks only  terms  the stock.  would get  judge fast. ' never  anything about public safety and deaths will pile . Musk   disturbed individual.,2021-09-25,-0.9997814297676086,0.002083333333333335,0.5944444444444444,2,0,0
"   tell  this isn' just for the stock market, please",2021-09-25,-0.9778683185577393,0.0,0.0,0,0,0
      You are already making stuff  due   broken sense  humor... feel free  extrapolate any nonsense you like from whatever  say.   never mentioned you owning stock.... ,2021-09-25,-0.997080385684967,-0.041666666666666664,0.525,0,0,0
      Never owned the stock. When folks respond with this they are tacitly capitulating  all the merits. Thank you.,2021-09-25,-0.9686130285263062,0.0,0.0,0,0,1
_for_Mini  buy tesla stock 🤪,2021-09-25,-0.9942512512207031,0.0,0.0,1,0,0
"  something something, the best car company  the world. How can somebody read this and think Tesla   leader  anything but fraud and should have  stock price  $774?",2021-09-25,0.9325166344642639,1.0,0.3,1,0,1
"   What other company can you work  where you know your hard work will absolutely contribute  dramatic increase  your personal wealth via stock ownership opportunities while also helping move the world forward  energy independence, sustainability, new forms  transport, etc",2021-09-25,0.9987218976020813,-0.08560606060606059,0.5285353535353535,3,2,2
"    Please  tell  the consequences  cashing out  billion  company stock  give  your employees who also own them too. Please, pretty please.   Besides getting into big trouble with the SEC for stock manipulation,  big chunk   will  taken away  taxes.  ",2021-09-25,-0.9987724423408508,0.09166666666666666,0.5000000000000001,0,0,0
Tesla stock  slipping  price today after Goldman Sachs turned negative  the stock and downgraded its shares  sell from neutral,2017-03-04,-0.9983866214752197,-0.2,0.25,0,0,0
Reactions From -Year Old Girl Who Rose  Fame After Tweet From Tesla CEO Elon Musk  ,2017-03-04,0.9124646782875061,0.35,0.575,0,0,0
Have Tesla Model  and Model  electric-car sales plateaued? - Yahoo News  ,2017-03-04,-0.9254423379898071,0.0,0.0,0,0,0
Snap. Crackle. POP: Lessons learned during the Snap IPO  -   TESLA TESLA TESLA TESLA,2017-03-04,0.9939648509025574,0.0,0.0,0,1,0
 added  video    playlist   What  Roller Coaster (Tesla Stock Price and  Energy Levels),2017-03-04,0.9974811673164368,0.0,0.0,0,0,0
Tesla Powerpack &amp; Craft Beer Come Together  Sierra Nevada Brewing Company  ,2017-03-04,0.9944741129875183,0.0,0.0,0,0,0
Why Tesla' $ Stock Buy-Back Won' Solve Its Problems    ,2017-03-04,-0.9937219023704529,0.0,0.0,0,0,0
What  Roller Coaster (Tesla Stock Price and  Energy Levels):   via ,2017-03-04,0.9966726303100586,0.0,0.0,0,0,0
 How  Tesla going  show tbeir appreciation.  Maybe  least 100 shares  stock!?,2017-03-04,0.8216707706451416,-0.375,0.4,0,0,0
$TSLA  take  all things Tesla  . Valuation . Sales . Brand . Subsides . Gigafactory . Unions . Harassment . Stock price . Trump  ,2017-03-04,-0.9982996582984924,0.0,0.0,3,2,1
This  the Electric Car That Really Could Kill Tesla - Motley Fool  ,2017-03-04,-0.9180843234062195,0.4,0.55,0,0,0
Analysts Say SolarCity Merger Torpedoing Tesla' Stock  ,2017-03-04,-0.9962838292121887,0.0,0.0,0,0,0
"Cheap, Clean &amp; Easy Way  Transport Skis   Tesla Model  – Video  ",2017-03-04,0.9997014403343201,0.4000000000000001,0.7444444444444445,0,0,0
TSLA Stock: Tesla Inc Can Now Directly Sell its Cars  Wyoming  ,2017-03-04,0.9724430441856384,0.1,0.4,0,0,0
"Tesla Model  P100D  Phenomenal, But Not The Most Practical Family Sedan – Video  ",2017-03-04,-0.8804107308387756,0.5,0.5,0,0,0
 liked   video from    Tesla Stock Rollercoaster: Hang   your hats! Elon Remains,2017-03-04,0.9733355641365051,0.75,0.8,1,1,0
Tesla Battery Teardown   Minutes – Video  ,2017-03-04,-0.9859544634819031,0.0,0.0,0,0,0
"Stock Buzz: Tesla Motors, Inc. (NASDAQ:TSLA)  Focus  ",2017-03-04,-0.8995705842971802,0.0,0.0,0,0,0
"  Consider that Bowsette caused Nintendo stock  rise and Elon Musk tweeting about cat girls caused Tesla' stock  briefly rise,  isn' THAT much   stretch.",2018-11-03,-0.9998351335525513,0.1,0.26666666666666666,0,0,0
     Stoner  know Jimney. Personally. Not old.  believe also not short tesla but perhaps ' mistaken.  has tweeted  much from time  time  the past btw.  take  easy just  stock. Breathe.....relax...let  all ...,2018-11-03,-0.9780901670455933,0.06666666666666668,0.35666666666666663,1,0,1
Piano Black Dashboards now  stock. TESLA TESLA  ,2018-11-03,0.9527134895324707,-0.16666666666666666,0.43333333333333335,11,0,4
"   someone who likes Tesla (&amp; has owned  few shares  the stock),  kinda wish ' stop sharing his opinions.",2018-11-03,-0.9999473094940186,-0.2,0.1,4,0,0
   Thanks Angel. Well said. But wait.. maybe you’ also just  paid  influencer??!! Maybe all the supporters are hired  Tesla just  push the stock and hurt shorts? That’ might  the whole reason that Tesla even exists!!!,2018-11-03,-0.9996974468231201,0.3515625,0.30000000000000004,3,0,0
TESLA STOCK LOSING STEAM!! INTEREST  THE UPSIDE  TESLA (TSLA) STOCK  GETTING WEAKER!!!  ,2018-11-03,-0.9998477697372437,0.0,0.0,0,0,0
 added  video    playlist   TESLA STOCK LOSING STEAM!! INTEREST  THE UPSIDE  TESLA (TSLA) STOCK,2018-11-03,-0.9989686012268066,0.0,0.0,0,0,0
Sell all your Tesla stock now.....,2018-11-03,-0.9906478524208069,0.0,0.0,0,0,0
Hey  will the ” winter tires  back  stock anytime soon?   ,2018-11-03,-0.6467379331588745,0.0,0.0,1,0,0
" _bilinski  Short case  not about the cars, nor primarily about Elon. ' about  unsustainable business that cannot survive / constant cap addition. The fact that Elon  desperately pumping the stock  being untruthful confirms the case.   didn', Tesla would have died already.",2018-11-03,-0.9992796778678894,-0.04999999999999999,0.5333333333333333,0,0,1
       understanding  Tesla can force the bondholders  take stock   averages above 360 for  days. This   limit profits ( stock were    400+). Otherwise  don’ understand the purpose  the current squeeze.,2018-11-03,-0.8766556978225708,0.0,0.25,0,0,1
 Reasons Tesla Inc (TSLA) Stock Could Have  Huge Fourth Quarter | Stock Market News |  News ⁦⁩ TESLA TESLA TESLA TESLA   ,2018-11-03,-0.8446840643882751,0.20000000000000004,0.45,2,1,0
"   Elon don' care - fudge those numbers, pump that stock baby!!!!",2018-11-03,0.9971482157707214,0.0,0.0,3,0,0
 finally  normal tweet. thanks and congrats  tesla stock rally off 250!,2018-11-03,-0.9793722033500671,0.2,0.42499999999999993,0,0,0
Bullish for $TSLA  Shorts don' understand why landing falcons  making tunnels  bullish for TESLA stock price.  ' because  proves (again) that    genius and  delivers.,2018-11-03,0.791568398475647,0.3,0.0,96,13,5
 liked   video   Stock Tesla Bullies ’  the DRAG STRIP + more!,2018-11-03,0.9964540004730225,0.375,0.45694444444444443,0,0,0
"  Very poor risk management,   jumped  pot stocks really early .  The only stock ’ currently interested   Tesla",2018-11-03,-0.999954104423523,-0.04250000000000001,0.645,1,0,0
Tesla Registers New Model  VINs For Europe  ,2018-11-03,0.9806634783744812,0.13636363636363635,0.45454545454545453,0,0,0
Tesla $TSLA Stock Rating Reaffirmed  Nomura   ,2018-11-03,-0.9924546480178833,0.0,0.0,0,0,0
Best explanation ’ seen from  about cost/benefit  taking Tesla private.   ) Transactions costs  going private &; benefits  brand from silencing short sellers.  ) Employees get distracted  both positive and negative stock price moves     ,2018-11-03,0.9748092293739319,0.15454545454545454,0.38257575757575757,0,0,0
" don' know about you but ' had  stock for  while now and '   for the long-haul. That company  changing the world for the better.    revolutionary. Invest  the company today, help build  better tomorrow! $TSLA",2018-11-03,0.998619794845581,0.5625,0.5,2,0,0
"(The Gazette) TESLA delivered  good earnings report : When  company beats Wall Street analysts’ earnings expectations, its stock price tends  rise. When Tesla announced third-quarter results last week,  didn’ merely beat ..    ",2018-11-03,-0.5146477222442627,0.06666666666666665,0.3888888888888889,0,0,0
  Money You could lose  Tesla' stock price increases.,2018-11-03,-0.9800341129302979,0.0,0.0,0,0,0
$TSLA Tesla' Stock Rally Hits Cycle Price Target -    via ,2018-11-03,0.9916025996208191,0.0,0.0,6,0,0
"  Listened. Excellent . Bought  model , amazing. The stock will   500 2019. ’ wrong  value Tesla   car manufacturer, ’ really  high end consumer electronic company, just happen   making car. Totally changing the way  transportation.",2018-11-03,-0.9323533773422241,0.252,0.818,0,0,0
" can you save the smart phone industry  making   phone with  headphone jack, stock Android and  notch?  Thank you.",2018-11-03,0.9311534762382507,0.21428571428571427,0.6428571428571429,0,0,0
" Tesla INC $TSLA Stock Declined, Shareholder  Capital Management LLC Has Trimmed Its Stake -  ",2018-11-03,-0.9995740056037903,0.0,0.0,0,0,0
" Tesla INC $TSLA Stock Declined, Shareholder  Capital Management LLC Decreased Its Position  $. Million  ",2018-11-03,-0.9993597865104675,-0.4,0.7,0,0,0
" Tesla INC $TSLA Share Value Declined, Holder  Capital Management LLC Has Lowered Position  ",2018-11-03,-0.9992732405662537,0.0,0.0,0,0,0
"Analysts take  look  Tesla, Inc. $TSLA having this  say.  ",2018-11-03,-0.6562091112136841,0.0,0.0,0,0,0
" __rosevear    Additional facts: . The stock market gets  wrong. . Companies relying  investors  fund losses are particularly hard hit  economic . . Quality, manufacturing efficiency and distribution will  economic drivers   for  decades. . False promises have consequences.",2018-11-03,-0.78204745054245,-0.15833333333333338,0.4883333333333333,0,0,1
" _M_Huettner ' short, but  still ""somehow"" managed  run the stock price  $100  the last  weeks  smoke and mirrors, and made (and continues  make) _Enforcement look impotent.  How  you deal with that?",2018-11-03,-0.997622549533844,0.0,0.18333333333333332,0,0,0
 Looks like  habe  lot  common buddy  same for  2nd biggest stock after tesla //,2018-11-03,-0.9865294694900513,-0.09999999999999999,0.20833333333333334,1,0,1
" _of_Europe , don' worry... They will receive Apple Stock Packs and  Tesla.",2018-11-03,-0.9897603392601013,0.0,0.0,0,0,0
" Thanks. But even  the evidence shows Tesla unlikely  meet musk’ predictions, how  you prove the predictions were made  mislead / pump stock? Musk always over-optimistic about future. Unless evidence states intention  mislead all seems very thin  .",2018-11-03,-0.9995343685150146,-0.20500000000000002,0.45625,0,0,1
" Tesla stock price will  500  2019, and will reach 1000  - years. Model    blockbuster. Hope all best smart get- passionate people work for you.",2018-11-03,0.9908225536346436,0.38809523809523805,0.5976190476190476,1,1,0
"__rosevear    John, facts are: . Stock market  reflecting expectations  future profitability (.. strategy) . There   disintegration  the classic TESLA value chain . There will  failures, there will  consolidation . Downturns will accelerate all  the above.",2018-11-03,-0.9628498554229736,0.05555555555555555,0.13055555555555554,0,0,2
"  interacted with both. Conspiracy theorists are delusional, have incoherent arguments and don’ look like big investors. Shorts are  bit smarter but don’ understand Tesla well. They spread conspiracy theories  drive the stock price down even  they know ’ fake news.",2018-11-03,0.8214184045791626,-0.2138888888888889,0.3888888888888889,1,0,0
"  Crystal. Maybe   hoping that Pana will actually pay them. Tesla desperately needed  show blowout results   attempt  get that stock above $360,   still think they will have extreme difficulty  paying that convertible back.",2018-11-03,-0.9953279495239258,-0.145,0.44000000000000006,1,0,1
  you hold some Bitcoin!  And Tesla Stock.   Good day sir.,2019-12-14,0.9953067898750305,0.7,0.6000000000000001,0,0,0
" ’  cult stock... like  also, bull markets love  find market “champions” like  &amp; they become market “rock stars” etc with valuation very secondary!",2019-12-14,0.5638822913169861,0.006249999999999978,0.495,0,0,0
    From the guy who also believes the  won'  produced because the stock has been juiced enough  this 'cobbled together' rush job.  When should Tesla  allowed  reveal new products  your opinion?   during the countless juicy auto shows like legacy auto?,2019-12-14,-0.9996931552886963,0.04545454545454545,0.48484848484848486,2,1,1
"Tesla, Microsoft, Facebook, Alibaba Stock - Earnings Results 2019!      ",2019-12-14,0.9315652251243591,0.0,0.0,0,0,0
    the stock wasn’  high  would invest! Lol. $358 per share.  need him  have one bad year   can buy  ton. Lol. Joking,2019-12-14,-0.900459349155426,0.275,0.6516666666666666,2,0,1
    ’ done custom kits  satin dark gray. Currently takes about - weeks  ship custom orders due  demand for the stock color options,2019-12-14,0.9198065400123596,-0.09166666666666667,0.39166666666666666,1,1,0
"Tesla (TSLA) stock price  the highest ' been  2019, closing   -week high | TESLARATI  ",2019-12-14,-0.9067557454109192,0.16,0.5399999999999999,0,0,0
" One day, there will   economics textbook with  section  the correlation between  tweets affecting Tesla stock &amp;  tweets affecting the stock market.",2019-12-14,-0.9976087808609009,0.0,0.0,5,0,0
" The money printer isn' the solar panels,   your insiders (.. Kimbal) selling shares into each stock pump, despite the fact that your company still loses  billion dollars  year. Your investors are the money printer.",2019-12-14,-0.9842151999473572,-0.3,0.1,0,0,0
    Tesla  doomed. Doomed  yell ! DOOMED!!!   run out right now and short the stock. ’ your train  fast cash. Easy money! Don’ wait short Tesla now!!,2019-12-14,-0.9999092817306519,0.2054761904761905,0.5138095238095237,2,0,1
Tesla..What Can You Say!! TESLA TESLA TESLA TESLA TESLA TESLA TESLA TESLA TESLA  ,2019-12-14,0.9994794726371765,0.0,0.0,0,0,0
Get  free stock. Claim  stock now without investing ANY money first   TESLA TESLA TESLA TESLA TESLA TESLA TESLA TESLA TESLA,2019-12-14,-0.9898786544799805,0.325,0.5666666666666667,0,0,0
"  Dec , 2019,  : , Justin Gardner &;.com&; wrote:   Scott,   The cost for the Anti-Ice Treatment  $150.    currently  not have stock  the product, but should  receiving some  the near future.  you want  check back   week  two",2019-12-14,-0.8358278274536133,0.025,0.23125,4,0,2
Help doctor  can physically see Tesla stock dropping % again,2019-12-14,-0.8912652134895325,0.0,0.14285714285714285,2,0,0
"' December , 2019  :45AM Get  free stock. Claim  stock now without investing ANY money first   TESLA TESLA TESLA TESLA TESLA TESLA TESLA TESLA",2019-12-14,-0.9701407551765442,0.325,0.5666666666666667,0,0,0
         _avoigt  _boutall  _Enough  Hahaha... they planned  take over   the  reveal  planned  reveal the   coincide with when they knew  wld   difficulty?   THAT  the level Tesla can plan  you should get   the stock ,2019-12-14,0.5222920179367065,0.1,0.45,1,0,1
