cleaned_text,date,sentiment_score,polarity,subjectivity,likes_count,retweets_count,replies_count
Insider trading corruption!The Sec  Def just announced $285M defense contract   company  owns stock  This comes after  bought  Tesla shares days before Biden announced  federal shift  electric vehicles.Dems should add insider trading2their party platform,2021-02-20,-0.9994392991065979,-0.1,0.6,0,0,0
 That number Will grow like  Tesla stock,2021-02-20,0.9739625453948975,0.0,0.0,0,0,0
 Reminds   when  joked about Tesla stock price being too high.,2021-02-20,-0.9962843656539917,0.16,0.5399999999999999,0,0,0
"     Tesla stock keep  going , the seller  covered call will lose money potentially 'unlimited' ?",2021-02-20,-0.99983811378479,0.0,1.0,0,0,1
The Secretary  Defense just announced  $285M defense contract   company  owns stock ...  This comes after Pelosi bought  Tesla shares days before Biden announced  federal shift  electric vehicles.  The Democrats should add insider trading  their party platform.,2021-02-20,-0.9995798468589783,0.0,0.0,5,1,0
" Seems like the more you tweet about crypto, the more your fans sell tesla stock and pile onto crypto. Why sabotage your own stock? Did you switch your focus from tesla ceo   crypto ceo?",2021-02-20,-0.9998739957809448,0.5333333333333333,0.6666666666666666,0,0,2
 Going Tesla stock  the moon ,2021-02-20,0.8614131808280945,0.0,0.0,1,0,0
The Secretary  Defense just announced  $285M defense contract   company  owns stock ...  This comes after Pelosi bought  Tesla shares days before Biden announced  federal shift  electric vehicles.  The Democrats should add insider trading  their party platform.,2021-02-20,-0.9995798468589783,0.0,0.0,0,0,0
"Tesla Stock price – Churchill Capital Surges  Lucrative Lucid Deal: CCIV, Fintech Zoom  which the former Citi banker' SPAC  known  Redditors and other retail fans,   the center  the stock market' latest ...   TESLA TESLA",2021-02-20,0.9961310625076294,0.06875,0.34375,0,0,0
 _radec77   said the same thing about Tesla stock around 900 pre split.,2021-02-20,-0.9999120235443115,0.0,0.125,0,0,0
The Secretary  Defense just announced  $285M defense contract   company  owns stock ... This comes after Pelosi bought  Tesla shares days before Biden announced  federal shift  electric vehicles. The Democrats should add insider trading  their party platform.,2021-02-20,-0.9995798468589783,0.0,0.0,2,0,0
  also said Tesla stock was overvalued and look what happened.,2021-02-20,-0.9997554421424866,0.0,0.0,2,0,0
  The fact that you are talking about one singular stock  Tesla proves his point. ’  isolated incident. The market ALWAYS corrects itself,2021-02-20,0.9752844572067261,0.3,0.0,1,0,0
 That’ what  said about Tesla stock when  was trading  $700 pre splits and look where   now?,2021-02-20,-0.7435060143470764,0.0,0.0,0,0,0
   _zzz      Tesla  way overvalued  well. Does that stop people from investing and surging the stock.  sir  does not,2021-02-20,-0.9788333773612976,0.0,0.0,1,0,1
Tesla..What Can You Say!! TESLA TESLA TESLA TESLA TESLA TESLA TESLA TESLA TESLA  ,2021-02-20,0.9994794726371765,0.0,0.0,0,0,0
   This  why ' never selling  Tesla stock.,2021-02-20,-0.9990395903587341,0.0,0.0,1,0,0
"__genji  yeah, this  true,  does not really care.  has his plan and will execute . But   does this shit,  will loose  lot for good will with ppl and though, influence power.   with $doge will  much more shit that  was when  said that tesla stock  ""expancive2",2021-02-20,-0.9998750686645508,0.139010989010989,0.5456043956043956,0,0,0
"Elon Musk says bitcoin seems high after surpassing $ trillion market value    ruse  try and buy more HTC perhaps?  1st May 2020 Elon Musk tweeted “Tesla stock price  too high imo” when  was $150  share, now ’ $780 having peaked  $900 TESLA",2021-02-20,-0.9997976422309875,0.2733333333333334,0.5266666666666667,25,8,5
Dow Jones Futures: Soaring Margin Debt Raises Concern For Market Rally; The Bear Case For Tesla Stock  ,2021-02-20,-0.580258846282959,0.0,0.0,0,0,0
UPDATE TESLA: Tesla Model  Sets New Range Record  606. Miles  ,2018-06-02,-0.9632695913314819,0.13636363636363635,0.45454545454545453,0,0,0
"  Yes, that'  the Devonshire Research Group,  company that' shorting Tesla stock. Coincidence ? Shouty caps aside, the study  gave you  indeed about the overall footprint. Just like this one  too:  ",2018-06-02,-0.9425007104873657,0.0,0.0,0,0,1
"        doubt Tesla has many haters. Some people are reacting   stock that' overpriced  most metrics,  questionable leadership, the lack  any independence from the board, unethical  not illegal acts like SolarCity acquisition  repeatedly misleading investors/customers.",2018-06-02,-0.9999285936355591,0.1875,0.625,1,0,1
Great interview! Like and Subscribe    own  &amp;  stock &amp;  skeptical   ever since the TESLA but their push for over  TESLA  2023   commitment  wish &amp; hope TESLA emulates! TESLA   ,2018-06-02,0.9970083832740784,0.325,0.75,0,0,0
  Seriously.   doesn’ get  free  out  this ’ selling all  stock  the company.,2018-06-02,-0.9968959093093872,0.033333333333333354,0.7333333333333334,1,0,0
Well-Known Billionaires Weigh   Tesla CEO Elon Musk  ,2018-06-02,0.955782413482666,0.0,0.0,0,0,0
Tesla Inc. $TSLA Stock Live Analysis --2017 TESLA  ,2018-06-02,0.970969021320343,0.13636363636363635,0.5,0,0,0
"Drove  Tesla today. ' getting one ASAP, and '  long  the stock, the only thing longer   &;redacted&; when  accelerates  Ludicrous Mode. '  spaceship, and now  Land Rover Discovery (   call , Rand Lover Very Disco) feels like  wheelbarrow.  ",2018-06-02,-0.9986659288406372,0.05000000000000001,0.5666666666666667,1,0,1
"Thank you for dreaming, and realizing  better world .  hold TESLA stock because  believe dreams can happen. Now  drive  Model   well, and feel  better future  within reach.  ",2018-06-02,0.9987657070159912,0.3333333333333333,0.375,1,0,0
  didn’ create Tesla..  first invested into  and eventually led   the biggest stock holder  the company and  appointed himself  CEO,2018-06-02,0.9841017127037048,0.25,0.3333333333333333,0,0,0
 How annoying   that everyone focuses  inevitably varying stock prices instead  issues that are actually important?,2018-06-02,-0.9999352693557739,-0.13333333333333333,0.9666666666666667,1,0,0
"   Also, the   presupposes stock  $300   high point. When Tesla  profitable/cashflow+ end  year $TSLA will  well over $400. That’ optimal time  fundraise ( needed) for Model  etc.  has  short sell thesis /negative bias.",2018-06-02,-0.9924934506416321,0.08,0.41999999999999993,0,0,0
Move over /Ford Tesla' got the wheel now !! TESLA TESLA TESLA TESLA TESLA TESLA TESLA TESLA TESLA  ,2018-06-02,0.9930186867713928,0.0,0.0,0,0,0
"Tesla Model ,  Bioweapon Defense Mode Could Save Your Life  ",2018-06-02,0.8172343373298645,0.0,0.0,0,0,0
"Tesla should delist, and start own exchange ...where  shorting allowed and investors must hold stock for  least six months.",2018-06-02,-0.9995695948600769,0.15,0.7,0,0,0
" Why not delist the stock, start your own Investor Exchange - shorting not allowed and investors must hold stock for  least  months?",2018-06-02,-0.999816358089447,0.15,0.7,0,0,0
"_acton Match the ROI? Uber credits...   kid.  Tesla stock...   jest.   Jetta, diesel.   cough.  Perhaps  car with two fathers, the BRZ / , will  strong and live long.",2018-06-02,-0.9998756647109985,0.17323232323232318,0.5444444444444444,0,0,0
") Tesla stock price can crash any time, making  raise impossible. Why  did they not raise when the price was above 350?   300?  now?",2018-06-02,-0.9996143579483032,-0.3333333333333333,0.55,0,0,1
 _aarts   „...and shit isn’ going your way“ Common misperception  $TSLA lemmings  that the stock price volatility isn’  money making opportunity and that all those who see Tesla and Musk for what they are are somehow „hurt“ when the price ticks . Reminder:ATH $389. Fri close ~$292,2018-06-02,-0.9964297413825989,-0.25,0.65,2,0,1
Can SolarCity and Gigafactory Supercharge Tesla Stock? |   TESLATESLA,2018-06-02,-0.9666279554367065,0.0,0.0,0,0,0
"Tesla' Focus Means Victory Versus Complacent Mainstream  Electric Cars, Analyst Says - Forbes  ",2017-07-01,0.9980248212814331,0.0,0.0,0,0,0
Chanos Says Tesla Stock  Not Worth ' Whole Lot'   via ,2017-07-01,-0.9998276233673096,0.02500000000000001,0.25,0,1,0
How Much  $TSLA' Elon Musk Worth? Tesla' Stock Continues  Soar   archived,2017-07-01,0.9766107797622681,0.25,0.15000000000000002,0,0,0
Tesla Stock Positioned  Fade  Model  Announcement   $TSLA,2017-07-01,-0.9985426664352417,0.0,0.0,0,0,0
Tesla Solar Roof Installations Behind Schedule?  ,2017-07-01,0.7355147004127502,-0.4,0.7,0,0,0
"Tesla' Focus Means Victory Versus Complacent Mainstream  Electric Cars, Analyst Says - Forbes  ",2017-07-01,0.9980248212814331,0.0,0.0,0,0,0
New Tesla Model  &amp;  Get Performance Boost:   . Seconds Off - Times  ,2017-07-01,-0.9672536849975586,0.13636363636363635,0.45454545454545453,0,0,0
"TESLA TESLA TESLA TESLA TESLA TESLA | Tesla Articles from The Washington Post, 1993 |    ",2017-07-01,0.9663290977478027,0.0,0.0,0,0,0
TESLA TESLA TESLA Tesla Stock  Gearing  For The Model  Launch.  ,2017-07-01,0.9982051849365234,0.0,0.0,1,0,0
Tesla Stock Positioned  Fade  Model  Announcement  ,2017-07-01,-0.9965330362319946,0.0,0.0,0,0,0
"Tesla Powerpack  Charge  Europe’ Largest Community, Battery Project  Nottingham  ",2017-07-01,0.9879970550537109,0.0,0.0,0,0,0
"New post: ""Tesla Stock Positioned  Fade  Model  Announcement""  ",2017-07-01,-0.9998595714569092,0.13636363636363635,0.45454545454545453,0,0,0
Tesla Stock Positioned  Fade  Model  Announcement  ,2017-07-01,-0.9965330362319946,0.0,0.0,1,0,0
Tesla Issues Statement  Establishment  Manufacturing Facility  China  ,2017-07-01,-0.9925731420516968,0.0,0.0,0,0,0
 Quick Guide For Upcoming Tesla Model  Owners  ,2017-07-01,0.9937278032302856,0.3333333333333333,0.5,0,0,0
Tesla Motors Inc. $TSLA Stock Live Analysis --2016 TESLA   ,2017-07-01,0.9687470197677612,0.13636363636363635,0.5,0,0,0
Tesla Stock Positioned  Fade  Model  Announcement - Seeking Alpha -   TESLA TESLA  ,2017-07-01,-0.9955589771270752,0.0,0.0,0,0,0
Tesla Stock  Gearing  For The Model  Launch    ,2017-07-01,0.9997243285179138,0.0,0.0,0,0,0
"Tesla' Focus Means Victory Versus Complacent Mainstream  Electric Cars, Analyst Says - Forbes  ",2017-07-01,0.9980248212814331,0.0,0.0,0,0,0
Tesla Stock  Gearing  For The Model  Launch  ,2017-07-01,0.9997243285179138,0.0,0.0,0,0,0
"Trading Notes - Active Stock Recap  Shares  Tesla, Inc. (NASDAQ:TSLA)  ",2017-06-30,0.847959041595459,-0.13333333333333333,0.6,1,0,0
How Much  $TSLA' Elon Musk Worth? Tesla' Stock Continues  Soar   archived,2017-06-30,0.9766107797622681,0.25,0.15000000000000002,1,1,0
Tesla Leads  Reasons Not  Tune Out Next Week: Investing Action Plan | Stock News &amp; Stock Market Analysis - IBD  ,2017-06-30,-0.8094735145568848,0.05,0.05,0,0,0
Tesla Stock Positioned  Fade  Model  Announcement   $TSLA buy low sell high big profits -  ,2017-06-30,-0.9985633492469788,0.05333333333333334,0.3133333333333333,0,1,0
"Electric-car lessons, better hybrids, Tesla crash data, rigging renewable energy: Today' Car News - Green Car Rep…  ",2017-06-30,0.8755109906196594,0.15,0.4,0,0,0
"Tesla' Focus Means Victory Versus Complacent Mainstream  Electric Cars, Analyst Says - Forbes  ",2017-06-30,0.9980248212814331,0.0,0.0,0,0,0
Tesla Stock Positioned  Fade  Model  Announcement - Seeking Alpha -   TESLA TESLA  ,2017-06-30,-0.9955589771270752,0.0,0.0,0,0,0
Tesla Stock Positioned  Fade  Model  Announcement   ,2017-06-30,-0.9965330362319946,0.0,0.0,0,0,0
Tesla Stock Positioned  Fade  Model  Announcement //channels.feeddigest.com/news?=5644816883,2017-06-30,-0.999138355255127,0.0,0.0,0,0,0
Tesla Stock Positioned  Fade  Model  Announcement  ,2017-06-30,-0.9965330362319946,0.0,0.0,0,0,0
Tesla Stock Positioned  Fade  Model  Announcement TESLA TESLA TESLA $TSLA    ,2017-06-30,-0.9976800084114075,0.0,0.0,0,0,0
Tesla Stock Positioned  Fade  Model  Announcement   $TSLA,2017-06-30,-0.9985426664352417,0.0,0.0,0,0,0
Tesla Powerwall  Installations Now Underway  Australia  ,2017-06-30,0.9983329176902771,0.0,0.0,0,0,0
Mark  Spiegel:  Rational Reason   Long Tesla Motors Stock (Video)  ,2017-06-30,0.5286967158317566,-0.05,0.4,0,0,0
"Electric-car lessons, better hybrids, Tesla crash data, rigging renewable energy: Today' Car News - Green Car Rep…  ",2017-06-30,0.8755109906196594,0.15,0.4,0,0,0
Tesla Focus Means Victory Versus Complacent Mainstream  Electric Car Market-Report - Forbes  ,2017-06-30,0.9943301677703857,0.0,0.0,0,0,0
.. Power Unhappy With Tesla’ Decision  Remain Out  Initial Quality Study  ,2017-06-30,-0.9433658123016357,-0.3,0.45,0,0,0
Virginia Auto Dealers Can Sue Tesla Over Second Store  ,2017-06-30,-0.9670866131782532,0.0,0.0,0,0,0
Tesla shares have hit  speed bump (TSLA)   What' pushing the stock down   more clear …  ,2017-06-30,-0.7036221027374268,0.14814814814814817,0.3907407407407408,0,0,0
$TSLA TESLA Stock Will Make You  Crash Test Dummy   TESLA TESLA TESLA TESLA $QQQ $SPY $DIA $AMZN $,2017-06-30,-0.9998249411582947,0.0,0.0,2,1,0
Watching the stock markets this morning. Tesla  falling again.   unpredictable.  TESLA TESLA,2017-06-30,0.9731196761131287,-0.16666666666666666,1.0,0,0,0
$TSLA current stock price: $362.. TESLA TESLA TESLA  ,2017-06-30,0.9853832721710205,0.0,0.4,8,3,0
" Get some raw veggies, some investors, cup  tesla stock...baby you got  stew goin!",2017-06-30,0.9861935973167419,-0.2884615384615385,0.46153846153846156,0,0,0
TESLA TESLA  Gearing  For The TESLA Launch  TESLA  ,2017-06-30,0.9996670484542847,0.0,0.0,0,0,0
"Stock for Tesla was 100 sumn  share then. They made that car and the Tesla truck, the stock  close  400 now.",2017-06-30,0.68692547082901,0.0,0.0,0,0,0
 told 'all  buy Tesla stock when they announced they were making the cheaper version.,2017-06-30,-0.9941458702087402,0.0,0.0,0,0,0
Teslanomics Predicts Tesla Model  Will Boost   Sales  %  ,2017-06-30,0.9466322064399719,0.0,0.0,1,0,0
Tesla Stock  Gearing  For The Model  Launch | Investopedia  ,2017-06-30,0.9907059073448181,0.0,0.0,0,0,0
Tesla Motors Inc. $TSLA Stock Live Analysis --2016 TESLA   ,2017-06-30,0.9687470197677612,0.13636363636363635,0.5,0,0,0
Tesla Stock  Gearing  For The Model  Launch | Investopedia  ,2017-06-30,0.9907059073448181,0.0,0.0,0,0,0
Elon Musk Teases Tesla Model  Release Date |    TESLA TESLA TESLA TESLA TESLA  ,2017-06-30,-0.9422968029975891,0.0,0.0,1,0,0
"Tesla, Inc. (TSLA) stock rose  .%! Currently priced  365.846.  ",2017-06-30,-0.6611010432243347,0.375,0.675,0,0,0
Buy Tesla Inc (TSLA)? Try This Undervalued Auto Stock Instead. -    ,2017-06-30,-0.9998766183853149,0.0,0.0,0,0,0
"IIHS says Tesla electric cars have higher miles, more costly repairs - Green Car Reports  ",2017-06-30,-0.9989981055259705,0.18333333333333335,0.43333333333333335,0,0,0
Elon Musk: Tesla Model  Release Date And “News”   Revealed Sunday  ,2017-06-30,0.971350371837616,0.0,0.0,0,0,0
Tesla Stock  Gearing  For The Model  Launch | Investopedia  ,2017-06-30,0.9907059073448181,0.0,0.0,0,0,0
There'  simple reason why Elon Musk always talks down the price  Tesla stock      ,2017-07-22,-0.5718326568603516,-0.07777777777777779,0.32301587301587303,0,0,0
There'  simple reason why Elon Musk always talks down the price  Tesla stock (TSLA) |TESLA TESLA TESLA TESLA|    ,2017-07-22,0.6054273247718811,-0.07777777777777779,0.32301587301587303,1,1,0
Posted  : @ Inc TESLA TESLA TESLA All the times Elon Musk has trash-talked Tesla’ stock price  overvalued …,2017-07-22,-0.9993829727172852,0.0,0.0,0,0,0
All the times Elon Musk has trash-talked Tesla’ stock price  overvalued   via ,2017-07-22,-0.9994192123413086,0.0,0.0,0,0,0
Inc: All the times Elon Musk has trash-talked Tesla’ stock price  overvalued   via ,2017-07-22,-0.9993484616279602,0.0,0.0,0,0,0
Inc: All the times Elon Musk has trash-talked Tesla’ stock price  overvalued   via ,2017-07-22,-0.9993484616279602,0.0,0.0,0,0,0
All the times Elon Musk has trash-talked Tesla’ stock price  overvalued   via ,2017-07-22,-0.9994192123413086,0.0,0.0,0,0,0
℅ TESLA⛹ All the times Elon Musk has trash-talked Tesla’ stock price  overvalued   via ,2017-07-22,-0.9997416138648987,0.0,0.0,0,0,0
All the times Elon Musk has trash-talked Tesla’ stock price  overvalued   via ,2017-07-22,-0.9994192123413086,0.0,0.0,0,0,0
All the times Elon Musk has trash-talked Tesla’ stock price  overvalued   via  TESLA,2017-07-22,-0.9994774460792542,0.0,0.0,0,0,0
All the times Elon Musk has trash-talked Tesla’ stock price  overvalued   via  &;   &;,2017-07-22,-0.9996953010559082,0.0,0.0,0,0,0
Biz Wire: All the times Elon Musk has trash-talked Tesla’ stock price  overvalued via     ,2017-07-22,-0.9980840682983398,0.0,0.0,0,0,0
All the times Elon Musk has trash-talked Tesla’ stock price  overvalued   via ,2017-07-22,-0.9994192123413086,0.0,0.0,0,0,0
Inc: All the times Elon Musk has trash-talked Tesla’ stock price  overvalued   via ,2017-07-22,-0.9993484616279602,0.0,0.0,0,0,0
All the times Elon Musk has trash-talked Tesla’ stock price  overvalued   via ,2017-07-22,-0.9994192123413086,0.0,0.0,0,0,0
All the times Elon Musk has trash-talked Tesla’ stock price  overvalued   via ,2017-07-22,-0.9994192123413086,0.0,0.0,0,0,0
All the times Elon Musk has trash-talked Tesla’ stock price  overvalued   via ,2017-07-22,-0.9994192123413086,0.0,0.0,0,0,0
All the times Elon Musk has trash-talked Tesla’ stock price  overvalued   via ,2017-07-22,-0.9994192123413086,0.0,0.0,10,6,2
There'  simple reason why Elon Musk always talks down the price  Tesla stock  ,2017-07-22,-0.5718326568603516,-0.07777777777777779,0.32301587301587303,0,0,0
There'  simple reason why Musk always talks down the price  Tesla stock (TSLA)   because ' way over-priced?  ,2017-07-22,-0.9998865127563477,-0.07777777777777779,0.32301587301587303,0,0,0
Other Automaker Execs Still Don’ See Tesla   Threat  ,2017-07-22,-0.9866597652435303,-0.125,0.375,0,0,0
There'  simple reason why Elon Musk always talks down the price  Tesla stock  ,2017-07-22,-0.5718326568603516,-0.07777777777777779,0.32301587301587303,0,0,0
Why Elon Musk always talks down the price  Tesla stock  ,2017-07-22,0.5541374683380127,-0.15555555555555559,0.2888888888888889,0,0,0
There'  simple reason why Elon Musk always talks down the price  Tesla stock   via ,2017-07-22,-0.6788910031318665,-0.07777777777777779,0.32301587301587303,0,0,0
ELON MUSK: Tesla' stock price  'low  you believe  Tesla' future' (TSLA)  ,2017-07-22,-0.7737357020378113,0.0,0.2125,0,0,0
There' one one big thing holding Tesla' stock back from rallying further   weak balance sheet  ,2017-07-22,-0.9999005794525146,-0.09375,0.30625,0,0,0
There'  simple reason why Elon Musk always talks down the price  Tesla stock (TSLA)   TESLA  ,2017-07-22,-0.634124219417572,-0.07777777777777779,0.32301587301587303,0,0,0
Tesla  dropping after Elon Musk says the stock price  'higher than  have any right  deserve' (TSLA)  ,2017-07-22,-0.9984075427055359,0.26785714285714285,0.5178571428571428,0,0,1
"  Yes  does, whenever  needs more money  just issues and sells more TESLA stock.",2017-07-22,0.8506609201431274,0.5,0.5,0,0,0
Tesla Turns  Open Sourcing For Updates  Mapping Platform  ,2017-07-22,0.992747962474823,0.0,0.5,0,0,0
There’  simple reason why Elon Musk always talks down the price  Tesla stock (TSLA)  ,2017-07-22,-0.6355347633361816,-0.07777777777777779,0.32301587301587303,0,0,0
There'  simple reason why Elon Musk always talks down the price  Tesla stock   via ,2017-07-22,-0.6788910031318665,-0.07777777777777779,0.32301587301587303,1,0,0
There'  simple reason why Elon Musk always talks down the price  Tesla stock (TSLA)    ,2017-07-22,-0.691160261631012,-0.07777777777777779,0.32301587301587303,0,0,0
" &amp; Stock Review  Tesla Motors, Inc. (NASDAQ:TSLA), Canadian Pacific Railway Limited ...  ",2017-07-22,0.9042418003082275,-0.07142857142857142,0.14285714285714285,0,0,0
"TESLA TESLA  Tesla stock had been   tear through the first half  2017,  one point threatening $400 …  ",2017-07-22,-0.9998151659965515,0.04166666666666667,0.25,0,0,0
Finance: There'  simple reason why Elon Musk always talks down the price  Tesla stock (TSLA): There&amp;TESLA…   TESLA,2017-07-22,0.9792218804359436,-0.07777777777777779,0.32301587301587303,0,0,0
There'  simple reason why Elon Musk always talks down the price  Tesla stock (TSLA)  ,2017-07-22,-0.691160261631012,-0.07777777777777779,0.32301587301587303,0,0,0
There'  simple reason why Elon Musk always talks down the price  Tesla stock   TESLA,2017-07-22,-0.7265347242355347,-0.07777777777777779,0.32301587301587303,0,0,0
There'  simple reason why Elon Musk always talks down the price  Tesla stock (TSLA): Tesla stock had.. TESLA  ,2017-07-22,0.6495531797409058,-0.07777777777777779,0.32301587301587303,0,0,0
There'  simple reason why Elon Musk always talks down the price  Tesla stock (TSLA)    ,2017-07-22,-0.691160261631012,-0.07777777777777779,0.32301587301587303,0,0,0
There'  simple reason why Elon Musk always talks down the price  Tesla stock  ,2017-07-22,-0.5718326568603516,-0.07777777777777779,0.32301587301587303,1,1,0
There’  simple reason why Elon Musk always talks down the price  Tesla stock (TSLA)    ,2017-07-22,-0.6355347633361816,-0.07777777777777779,0.32301587301587303,0,0,0
There'  simple reason why Elon Musk always talks down the price  Tesla stock (TSLA)  ,2017-07-22,-0.691160261631012,-0.07777777777777779,0.32301587301587303,0,0,0
There'  simple reason why Elon Musk always talks down the price  Tesla stock (TSLA)    ,2017-07-22,-0.691160261631012,-0.07777777777777779,0.32301587301587303,0,0,0
"""There'  simple reason why Elon Musk always talks down the price  Tesla stock (TSLA)""  ",2017-07-22,-0.6252298951148987,-0.07777777777777779,0.32301587301587303,0,0,0
There'  method  his apparent madness. And ' critical  Tesla' survival. Tesla stock had been   tear...  ,2017-07-22,-0.6878641247749329,0.025,0.575,0,0,0
There'  simple reason why Elon Musk always talks down the price  Tesla stock (TSLA) -  ,2017-07-22,0.5683298707008362,-0.07777777777777779,0.32301587301587303,0,0,0
There'  simple reason why Elon Musk always talks down the price  Tesla stock (TSLA)    ,2017-07-22,-0.691160261631012,-0.07777777777777779,0.32301587301587303,0,0,0
There'  simple reason why Elon Musk always talks down the price  Tesla stock (TSLA…  ,2017-07-22,-0.7131866216659546,-0.07777777777777779,0.32301587301587303,0,0,0
Elon Musk always talks down the price  Tesla stock    ,2017-07-22,0.6733487248420715,-0.15555555555555559,0.2888888888888889,0,0,0
There'  simple reason why Elon Musk always talks down the price  Tesla stock  ,2017-07-22,-0.5718326568603516,-0.07777777777777779,0.32301587301587303,0,0,0
There'  simple reason why Elon Musk always talks down the price  Tesla stock (TSLA)  ,2017-07-22,-0.691160261631012,-0.07777777777777779,0.32301587301587303,0,0,0
There'  simple reason why Elon Musk always talks down the price  Tesla stock (TSLA)  ,2017-07-22,-0.691160261631012,-0.07777777777777779,0.32301587301587303,0,0,0
There'  simple reason why Elon Musk always talks down the price  Tesla stock (TSLA…  ,2017-07-22,-0.7131866216659546,-0.07777777777777779,0.32301587301587303,0,0,0
There'  simple reason why Elon Musk always talks down the price  Tesla stock - Markets Insider -   TESLA TESLA  ,2017-07-22,-0.6270048022270203,-0.07777777777777779,0.32301587301587303,0,0,0
"TESLA:""There'  simple reason why Elon Musk always talks down the price  Tesla stock (TSLA)""  ",2017-07-22,0.6053570508956909,-0.07777777777777779,0.32301587301587303,0,0,0
There'  simple reason why Elon Musk always talks down the price  Tesla stock (TSLA)  ,2017-07-22,-0.691160261631012,-0.07777777777777779,0.32301587301587303,0,0,0
There'  simple reason why Elon Musk always talks down the price  Tesla stock (TSLA)  ,2017-07-22,-0.691160261631012,-0.07777777777777779,0.32301587301587303,0,0,0
There'  simple reason why Elon Musk always talks down the price  Tesla stock (TSLA): Tesla stock had been ...  ,2017-07-22,-0.6115721464157104,-0.07777777777777779,0.32301587301587303,0,0,0
There'  simple reason why Elon Musk always talks down the price  Tesla stock (TSLA)    ,2017-07-22,-0.691160261631012,-0.07777777777777779,0.32301587301587303,0,0,0
One word for the stock rollercoaster this past year...madness! -Tesla was the best auto stock for 2018  ,2018-12-15,0.9996609687805176,0.34375,0.275,4,1,0
"   you could handle the insanity, Tesla was the best auto stock  invest  for 2018   ",2018-12-15,0.9264463186264038,1.0,0.3,0,0,0
"_delete  _Bismuth    you’ saying you modified  vehicle, and are comparing    stock vehicle? You know that stock vehicle can also  modified right?",2018-12-15,-0.9999721050262451,0.2857142857142857,0.5357142857142857,2,0,1
TSLA' resilience  the stock market  partly due  the 'Tesla Killers'' failure - Teslarati  ,2018-12-15,0.8383311629295349,-0.22083333333333335,0.3375,0,0,0
(Stock going  400.  Tesla not that Beta-Volatile) Elon Musk tweets fans might see  Tesla pickup truck next year (2019!) Keep Tesla  the radar!  ,2018-12-15,0.730511486530304,0.0,0.0,0,0,0
Apparently some wacko musketeers think they can file complaints  the SEC  others submitting tips about Tesla  any other company arguing ’ really some form  stock manipulation with crazy conspiracy theories ala shorts etc.Please  knock yourself out Crazy ppl out there,2018-12-15,-0.9999144077301025,-0.1958333333333333,0.5541666666666666,26,2,5
 are the flame throwers still  stock  have  burn  Honda and get  Tesla.,2018-12-15,-0.570930540561676,0.0,0.0,0,0,0
Tesla was the best auto stock for 2018 - Business Insider TESLA - GREAT STOCKS   ,2018-12-15,0.9873670339584351,0.9,0.525,0,0,0
