{"id": 1307469223338278914, "date": "2020-09-19", "time": "19:58:49", "tweet": "@miss_timi Listen to or read a new book, input gold instead of meaningless bitcoin. This repetitive caca is a poor substitute for entertainment.", "likes_count": 0, "replies_count": 1, "retweets_count": 0, "hashtags": []}
{"id": 1307469146100121601, "date": "2020-09-19", "time": "19:58:30", "tweet": "Well, I guess my input if anyone cares is that twitlonger is used for longer messages, I've used it myself. The formatting of \"that\" joke is the problem, honestly \"triggering\" to some people, even myself included, I can feel my heart sink everytime I see it.", "likes_count": 13, "replies_count": 1, "retweets_count": 0, "hashtags": []}
{"id": 1307469094028017665, "date": "2020-09-19", "time": "19:58:18", "tweet": "@TwitchLunaLewd Thanks for the input but I dont know any of these characters aside from Fruits Basket and Kyo/Tohru isnt exactly what I have in mind.", "likes_count": 0, "replies_count": 1, "retweets_count": 0, "hashtags": []}
{"id": 1307469085475835906, "date": "2020-09-19", "time": "19:58:16", "tweet": "So it is a relation between a low cardiac output in comparison to a high blood input due to exceeding heart muscle contraction capacity and thus we get an eccentric hypertrophy or dilated cardiomyopathy or systolic dysfunction HF .. all are the different names for one disease.", "likes_count": 1, "replies_count": 1, "retweets_count": 0, "hashtags": []}
{"id": 1307468963006177280, "date": "2020-09-19", "time": "19:57:47", "tweet": "@realist @hillelogram And to DMN’s DRDs? Though I consider those conceptually acceptable – if a node is a decision table the edges are inferrable from the input &amp; output column names. What’s the main criticism for those?", "likes_count": 0, "replies_count": 1, "retweets_count": 0, "hashtags": []}
{"id": 1307468884811943936, "date": "2020-09-19", "time": "19:57:28", "tweet": "Any videos in particular that anybody would like to see? @LynxxOX and I have already thought up some bangers, but we'd like to hear input from our community.", "likes_count": 6, "replies_count": 3, "retweets_count": 0, "hashtags": []}
{"id": 1307468683825078272, "date": "2020-09-19", "time": "19:56:40", "tweet": "@mch_tweets Love Zenni! (even though it basically told me I have a child's head), you can input your pupillary distance and order glasses accordingly", "likes_count": 1, "replies_count": 1, "retweets_count": 0, "hashtags": []}
{"id": 1307468620587360258, "date": "2020-09-19", "time": "19:56:25", "tweet": "@IDoTheThinking You should do more! Solid detective work. Many ML engineers don't even look at the data, studying the outputs of learning curves or what have you. The  input-output experiments you ran are exactly the sort of diagnostics stress-tests folks at twitter should be running.", "likes_count": 3, "replies_count": 1, "retweets_count": 0, "hashtags": []}
{"id": 1307468346212978693, "date": "2020-09-19", "time": "19:55:19", "tweet": "@Evsthetractor @awright4645 @DefraGovUK this motley crew of global corporates. Look for eg IKEA and YARA &amp; Nestle on there enough said. And the UN's Erik Solheim, their BIG buddy making sure they had input at the UN Environment, where he had to resign in disgrace over air miles. The utter NERVE of it! A bit more about  https://t.co/ilpYlyfDAA", "likes_count": 0, "replies_count": 1, "retweets_count": 0, "hashtags": []}
{"id": 1307468328106168326, "date": "2020-09-19", "time": "19:55:15", "tweet": "This is why the game needs gatekeepers. Everyone doesn't deserve input. It's not rude, just the right thing to do.  Ja Morant earned that award", "likes_count": 9, "replies_count": 3, "retweets_count": 0, "hashtags": []}
{"id": 1307468174544306181, "date": "2020-09-19", "time": "19:54:39", "tweet": "@ApexMB_ I feel like Cold War is ur kind of game!! Just played my first few games, and your input speed is purf for it. Bet ur slaaayyyyiiiinnnngg... other than SBMM", "likes_count": 1, "replies_count": 2, "retweets_count": 0, "hashtags": []}
{"id": 1307468137592426497, "date": "2020-09-19", "time": "19:54:30", "tweet": "Good input from one of our consultants. :)", "likes_count": 2, "replies_count": 1, "retweets_count": 0, "hashtags": []}
{"id": 1307468085713043456, "date": "2020-09-19", "time": "19:54:17", "tweet": "Fyi, I had zero input on LC’s choreo. @WilliamFriedkin ‘s film that utilized Sayoc, has been *the knife fight source for numerous stunt / fight coordinators. His film was way ahead of its time.", "likes_count": 5, "replies_count": 1, "retweets_count": 1, "hashtags": []}
{"id": 1307468078658142208, "date": "2020-09-19", "time": "19:54:16", "tweet": ".@haraldvdijk added support for libfsm to construct a regexp AST, given an FSM as input.  This is especially cool because the FSM needn't have come from a regexp.  Here I'm subtracting one FSM from another, and rendering out the AST to regexp syntax.  https://t.co/ypwUsyfOfk", "likes_count": 26, "replies_count": 2, "retweets_count": 1, "hashtags": []}
{"id": 1307467842879729665, "date": "2020-09-19", "time": "19:53:19", "tweet": "@MookieMoogle @TheQuQu Realistically it's a better controller than a keyboard. Since you have analog steering input, rather than digital.", "likes_count": 1, "replies_count": 1, "retweets_count": 0, "hashtags": []}
{"id": 1307467797967052800, "date": "2020-09-19", "time": "19:53:09", "tweet": "@NYFG_ @Paul_Dunk @RSL_Studio Love Sam Hancocks input but outside of that it's been terrible. Feel sorry Louise also who just keeps getting ignored when she makes a point.", "likes_count": 0, "replies_count": 1, "retweets_count": 0, "hashtags": []}
{"id": 1307467639393001474, "date": "2020-09-19", "time": "19:52:31", "tweet": "@sierran731 @loststock_ hello! yes I did. style &amp; colour wise the bits were all totally in line with the preferences I’d input &amp; I was super happy with it.", "likes_count": 1, "replies_count": 1, "retweets_count": 0, "hashtags": []}
{"id": 1307467490679693313, "date": "2020-09-19", "time": "19:51:56", "tweet": "@Fransie1981 Good to know, Frans. Thanks for the input! 👍🏼", "likes_count": 0, "replies_count": 0, "retweets_count": 0, "hashtags": []}
{"id": 1307467411159953408, "date": "2020-09-19", "time": "19:51:37", "tweet": "&gt; come back from running errands all day to like 70 notifications &gt; almost all of them are an argument that has nothing to do with me  I love you guys and I want your input, but PLEASE untag me if I haven’t liked or replied to anything for like 10 tweets.", "likes_count": 42, "replies_count": 4, "retweets_count": 2, "hashtags": []}
{"id": 1307467385629278209, "date": "2020-09-19", "time": "19:51:30", "tweet": "Remora midi, nodejs &gt; midi input -&gt; UDP test. Still lots of latence, WiFi 10 mtrs away from #esp32. But starts to be something. With some good programming, maybe not me... It could be great fun for people that make music with midi instruments (directly midi thrunno WiFi latence)  https://t.co/KlW6CGgPkB", "likes_count": 1, "replies_count": 0, "retweets_count": 2, "hashtags": ["esp32"]}
