{"id": 1370887335047536642, "date": "2021-03-13", "time": "18:59:45", "tweet": "@ShxdwSKI @ExcusesFN did he lower ping and input delay?", "likes_count": 0, "replies_count": 0, "retweets_count": 0, "hashtags": []}
{"id": 1370887185990365185, "date": "2021-03-13", "time": "18:59:09", "tweet": "@Politelyrude55 @PALaborIndustry Riiiight! 💯 👑 🙌 🔥 #facts considering they had to wait for the law to go in2 effect, they couldn't input early or it'd void the end of the last we have from Trump. IRS has the $1400 hittin accts already too. Everyone needs 2 exhale and chill. #respect on being rational 4real!", "likes_count": 0, "replies_count": 0, "retweets_count": 0, "hashtags": ["facts", "respect"]}
{"id": 1370887148249972738, "date": "2021-03-13", "time": "18:59:00", "tweet": "@vickyhartzler  Please allow me to thank you and Rep Lamburn for writing your letter re: Navy reading for sailors.  You provided a much needed input of reason, wisdom and judgement in a chaotic world for our Navy.  Pls thank Rep Lamburn - unable to find an address. CAPT USN (ret)", "likes_count": 0, "replies_count": 0, "retweets_count": 0, "hashtags": []}
{"id": 1370887059481763844, "date": "2021-03-13", "time": "18:58:39", "tweet": "I told someone today that I get paid to think these days and he looked shocked.  I mean, I get to execute when things ain't going as planned but still...  The thinking is the best part for me. See a problem, input all factors, fashion a solution.", "likes_count": 0, "replies_count": 0, "retweets_count": 0, "hashtags": []}
{"id": 1370887030201274368, "date": "2021-03-13", "time": "18:58:32", "tweet": "@Saker_MV @mightyohm @mightyohm if you want to play with wide band measurement you might want want to try to get a few LT1088. Their 3db pt is 300MHz. That's better than the HP3400 and it's on one chip, just add an input attenuator/preamp.   https://t.co/lVL9Lc4sds", "likes_count": 1, "replies_count": 1, "retweets_count": 0, "hashtags": []}
{"id": 1370886979949371396, "date": "2021-03-13", "time": "18:58:20", "tweet": "@OrderDawn A vaccine is the introduction of dead virus to train the immune system to fight the live one... it seems very shady to go against the established meaning of the term, while at the same time demanding protection from all liability!  Anyhow, thank you for your input...", "likes_count": 1, "replies_count": 1, "retweets_count": 0, "hashtags": []}
{"id": 1370886958646317063, "date": "2021-03-13", "time": "18:58:15", "tweet": "I'm trying to talk Spouse into running a KOTH menu at work and he's refusing.  What food/dish would best represent each character?  @Freeyourmindkid , your input is invaluable here.", "likes_count": 0, "replies_count": 1, "retweets_count": 0, "hashtags": []}
{"id": 1370886947225231367, "date": "2021-03-13", "time": "18:58:12", "tweet": "@bytemaster7 the community management of EOS blockchain should be broad, which is to establish a rule and legal system for the future. Therefore, what needs to be input is for professionals from all walks of life to work together to create a comprehensive set of rules for data access,", "likes_count": 0, "replies_count": 0, "retweets_count": 0, "hashtags": []}
{"id": 1370886870641614854, "date": "2021-03-13", "time": "18:57:54", "tweet": "&lt;h1 class=\"tdb-title-text\"&gt;Interactive Map of Earth’s Asteroid and Meteor Impact Craters&lt;/h1&gt;&lt;input class=\"testing\" type=\"hidden\" value=\"Image Credit : Public Domain\"&gt;  https://t.co/MDWNEQfPz3 via @HeritageDaily - Archaeology News", "likes_count": 0, "replies_count": 0, "retweets_count": 0, "hashtags": []}
{"id": 1370886828606259204, "date": "2021-03-13", "time": "18:57:44", "tweet": "What is the meme for sending tracks to friends to collab or give input on who don’t respond", "likes_count": 2, "replies_count": 1, "retweets_count": 0, "hashtags": []}
{"id": 1370886758217388032, "date": "2021-03-13", "time": "18:57:27", "tweet": "@JeanJm24 @Propmach @EricTrump Keep saying input, but facts are facts. Trump is the greatest American President ever.  He made America gray again but the democrats rigged the election process and you guys will pay someday.", "likes_count": 0, "replies_count": 3, "retweets_count": 0, "hashtags": []}
{"id": 1370886712696696832, "date": "2021-03-13", "time": "18:57:16", "tweet": "@RealCptSplooge @Herr_Schlake @du27102i @yourbae420 @xlucymoorex i never accused ALL men though. actually, nobody has for that matter. but you ignorant mfs input the “all” before the “men” every single time when its never there. either way, you arent taking the time to understand where women are coming from either. youre literally the+", "likes_count": 0, "replies_count": 2, "retweets_count": 0, "hashtags": []}
{"id": 1370886545754968064, "date": "2021-03-13", "time": "18:56:37", "tweet": "I think men shud not have any input on what A woman does with her body! Period", "likes_count": 0, "replies_count": 0, "retweets_count": 0, "hashtags": []}
{"id": 1370886397381517313, "date": "2021-03-13", "time": "18:56:01", "tweet": "Interesting read, anyone familiar with commercial lending and multi family real estate have any input?", "likes_count": 0, "replies_count": 0, "retweets_count": 0, "hashtags": []}
{"id": 1370886354754809857, "date": "2021-03-13", "time": "18:55:51", "tweet": "@derridaddy ahaha ty for the input tho lol", "likes_count": 1, "replies_count": 0, "retweets_count": 0, "hashtags": []}
{"id": 1370886329702232066, "date": "2021-03-13", "time": "18:55:45", "tweet": "@Boogie2988 persona 3 is better then persona 5 not even going to input on earthbound that game is on a whole different level of Great-Ness on it's own.", "likes_count": 1, "replies_count": 1, "retweets_count": 0, "hashtags": []}
{"id": 1370886230498492419, "date": "2021-03-13", "time": "18:55:21", "tweet": "@massicol @CaligaraAnna @Marilyna2121 Infatti era uno scherzo, però l'input era carino. E la numerazione romana anche.  🍺", "likes_count": 1, "replies_count": 1, "retweets_count": 0, "hashtags": []}
{"id": 1370886194058428416, "date": "2021-03-13", "time": "18:55:13", "tweet": "@ChristopherHahn @joncoopertweets I think this makes a decision to prosecute less likely because he’d be leaving his successor something about which he or she had no input.  Unless there’s a statute of limitations running out.  A decision not to prosecute or saying nothing doesn’t do that.", "likes_count": 4, "replies_count": 0, "retweets_count": 0, "hashtags": []}
{"id": 1370886169899245568, "date": "2021-03-13", "time": "18:55:07", "tweet": "@AlejandfoC @UCarbonizado @Wismichu @lashIndustries aquí tienes la primera parte, te los ves y luego saca tu propia opinión de las cosas  https://t.co/TyQ885JA4A", "likes_count": 0, "replies_count": 2, "retweets_count": 0, "hashtags": []}
{"id": 1370886126643257345, "date": "2021-03-13", "time": "18:54:57", "tweet": "@Breeetee @BarbaraCrazyCat @mspixieriot @ChefMPhillips So perhaps, and this is just a thought, Maybe your input, about a subject you know nothing about, isn't worth the data it takes to post on twitter?", "likes_count": 2, "replies_count": 1, "retweets_count": 0, "hashtags": []}
